{"answers":[{"blocks":[{"source_order":1,"status":"CONFIRMADO","text":"A disciplina que servirá de base para o ebook é “Inteligência de Mercado, Monitoramento da Concorrência e Ferramentas para Tomada de Decisão”."},{"source_order":2,"status":"PREMISSA_EDITORIAL","text":"A disciplina insere-se no campo da gestão, estratégia e inteligência competitiva, com foco na utilização sistemática de informações de mercado e da concorrência para subsidiar decisões empresariais."},{"source_order":3,"status":"PREMISSA_EDITORIAL","text":"O conteúdo deverá articular fundamentos de inteligência de mercado, processos de coleta e análise de informações, monitoramento competitivo, métodos de análise, visualização de dados e aplicação das evidências ao processo decisório."},{"source_order":4,"status":"PENDENTE","text":"Não foram informados curso específico, modalidade, carga horária, ementa institucional oficial, posição da disciplina na matriz curricular ou documentos institucionais complementares."},{"source_order":5,"status":"PREMISSA_EDITORIAL","text":"Para fins de desenvolvimento, a estrutura de capítulos fornecida poderá funcionar como referência para uma ementa de trabalho, sem ser tratada como ementa institucional oficial."}],"question_number":1},{"blocks":[{"source_order":6,"status":"PREMISSA_EDITORIAL","text":"O ebook deverá ser direcionado prioritariamente a estudantes de pós-graduação, especialização ou MBA vinculados às áreas de gestão, negócios, marketing, estratégia, inteligência de mercado, planejamento ou áreas correlatas."},{"source_order":7,"status":"PREMISSA_EDITORIAL","text":"O público poderá apresentar formação acadêmica e experiências profissionais heterogêneas, incluindo profissionais que atuem ou pretendam atuar em funções relacionadas à gestão, análise de mercado, marketing, comercial, planejamento, estratégia ou apoio à tomada de decisão."},{"source_order":8,"status":"PREMISSA_EDITORIAL","text":"Não deverá ser presumido domínio prévio de técnicas avançadas de inteligência competitiva, análise de dados ou ferramentas analíticas. Conceitos e métodos deverão ser introduzidos progressivamente, com explicação de sua finalidade e de suas aplicações."},{"source_order":9,"status":"PREMISSA_EDITORIAL","text":"Entre as principais necessidades de aprendizagem estão compreender como transformar informações dispersas em inteligência útil, distinguir dados relevantes de informações pouco significativas, estruturar processos de monitoramento de mercado e concorrentes e comunicar análises de forma adequada aos responsáveis pela decisão."},{"source_order":10,"status":"PREMISSA_EDITORIAL","text":"Uma dificuldade relevante poderá ser a passagem da simples coleta de dados para a análise estratégica. O material deverá, portanto, enfatizar interpretação, comparação, contextualização e utilização das informações na tomada de decisão."},{"source_order":11,"status":"PREMISSA_EDITORIAL","text":"O contexto profissional considerado deverá envolver situações organizacionais em que decisões relacionadas a mercados, concorrentes, posicionamento, oportunidades, ameaças e prioridades estratégicas dependam de informações estruturadas e analisadas."}],"question_number":2},{"blocks":[{"source_order":12,"status":"PREMISSA_EDITORIAL","text":"O objetivo geral da disciplina será capacitar o estudante a compreender, estruturar e aplicar processos de inteligência de mercado e monitoramento da concorrência, utilizando métodos, ferramentas e evidências para apoiar decisões organizacionais."},{"source_order":13,"status":"PREMISSA_EDITORIAL","text":"Ao final da disciplina, o estudante deverá ser capaz de compreender os fundamentos e o escopo da inteligência de mercado contemporânea; relacionar atividades de inteligência aos objetivos estratégicos da organização; estruturar o ciclo de coleta, tratamento, análise e disseminação de informações; mapear mercados e identificar concorrentes relevantes; selecionar e avaliar fontes de informação estratégica; aplicar métodos de análise competitiva; organizar resultados em relatórios, dashboards e recursos de visualização; e utilizar evidências para fundamentar decisões empresariais."},{"source_order":14,"status":"PREMISSA_EDITORIAL","text":"As competências desenvolvidas deverão incluir pensamento analítico, interpretação estratégica de informações, avaliação crítica de fontes, análise de concorrentes, síntese de evidências, comunicação gerencial e tomada de decisão orientada por dados."},{"source_order":15,"status":"PREMISSA_EDITORIAL","text":"Como resultados de aprendizagem, espera-se que o estudante consiga transformar informações de mercado em análises estruturadas, identificar movimentos competitivos relevantes, selecionar ferramentas adequadas para diferentes problemas de análise e produzir informações acionáveis para gestores e tomadores de decisão."},{"source_order":16,"status":"PREMISSA_EDITORIAL","text":"As evidências de aprendizagem poderão incluir análises comparativas de concorrentes, mapas de mercado, aplicação de métodos de análise competitiva, interpretação de indicadores, elaboração de estruturas de dashboards ou relatórios gerenciais e resolução de situações decisórias baseadas em dados."},{"source_order":17,"status":"PREMISSA_EDITORIAL","text":"As aplicações profissionais deverão abranger planejamento estratégico, marketing, gestão comercial, desenvolvimento de negócios, posicionamento competitivo, identificação de oportunidades, avaliação de ameaças e apoio a decisões gerenciais."}],"question_number":3},{"blocks":[{"source_order":18,"status":"CONFIRMADO","text":"O ebook deverá seguir a seguinte estrutura geral:\n\nIntrodução\n\nA introdução deverá contextualizar a relevância da inteligência de mercado e do monitoramento da concorrência em ambientes empresariais caracterizados por grande disponibilidade de informações, mudanças competitivas e necessidade de decisões fundamentadas.\n\nCapítulo 1 — Definições e Escopo da Inteligência de Mercado Contemporânea"},{"source_order":19,"status":"CONFIRMADO","text":"Este capítulo estabelecerá os fundamentos conceituais da disciplina."},{"source_order":20,"status":"PREMISSA_EDITORIAL","text":"Deverá diferenciar inteligência de mercado de simples coleta de dados e apresentar sua relação com inteligência competitiva, pesquisa de mercado, análise estratégica e suporte à decisão.\n\nCapítulo 2 — Alinhamento da Inteligência de Mercado aos Objetivos de Negócio"},{"source_order":21,"status":"CONFIRMADO","text":"O capítulo deverá relacionar a inteligência de mercado às necessidades estratégicas da organização."},{"source_order":22,"status":"PREMISSA_EDITORIAL","text":"Deverá demonstrar que processos de inteligência precisam partir de questões decisórias, prioridades organizacionais e objetivos de negócio, evitando coleta indiscriminada de informações.\n\nCapítulo 3 — Ciclo da Inteligência de Mercado: Coleta, Tratamento, Análise e Disseminação"},{"source_order":23,"status":"CONFIRMADO","text":"O capítulo deverá apresentar o processo estruturado de produção da inteligência de mercado."},{"source_order":24,"status":"PREMISSA_EDITORIAL","text":"Deverá desenvolver as etapas de definição das necessidades informacionais, coleta, organização, tratamento, análise, síntese e disseminação das informações aos usuários responsáveis pelas decisões.\n\nCapítulo 4 — Mapeamento de Mercado e Identificação de Concorrentes"},{"source_order":25,"status":"CONFIRMADO","text":"O capítulo deverá tratar do reconhecimento da estrutura competitiva do mercado."},{"source_order":26,"status":"PREMISSA_EDITORIAL","text":"Deverá abordar delimitação de mercado, identificação de concorrentes diretos e indiretos, segmentos, atores relevantes, posicionamentos e critérios para priorização dos concorrentes que merecem acompanhamento.\n\nCapítulo 5 — Monitoramento da Concorrência e Fontes de Informação Estratégica"},{"source_order":27,"status":"CONFIRMADO","text":"O capítulo deverá desenvolver procedimentos de acompanhamento sistemático dos concorrentes."},{"source_order":28,"status":"PREMISSA_EDITORIAL","text":"Deverá discutir fontes públicas, institucionais, comerciais e digitais de informação, critérios de confiabilidade, atualização e relevância, além da necessidade de utilização ética e lícita das informações.\n\nCapítulo 6 — Métodos e Ferramentas de Análise Competitiva"},{"source_order":29,"status":"CONFIRMADO","text":"O capítulo deverá apresentar métodos capazes de transformar dados coletados em interpretações competitivas."},{"source_order":30,"status":"PREMISSA_EDITORIAL","text":"Poderá incluir técnicas de comparação, análise de posicionamento, benchmarking competitivo, análise de forças competitivas, matrizes e outras ferramentas compatíveis com problemas de inteligência de mercado, desde que sua aplicação seja explicada criticamente e não apenas apresentada como modelo pronto.\n\nCapítulo 7 — Relatórios Gerenciais, Dashboards e Visualização para Apoio à Decisão"},{"source_order":31,"status":"CONFIRMADO","text":"O capítulo deverá tratar da comunicação dos resultados produzidos pelo processo de inteligência."},{"source_order":32,"status":"PREMISSA_EDITORIAL","text":"Deverá abordar seleção de indicadores, síntese de informações, construção de relatórios executivos, princípios de dashboards, visualização de dados e adaptação da apresentação ao perfil e às necessidades do tomador de decisão.\n\nCapítulo 8 — Tomada de Decisão Baseada em Dados e Inteligência Competitiva Aplicada"},{"source_order":33,"status":"CONFIRMADO","text":"O capítulo deverá integrar os conhecimentos desenvolvidos anteriormente e direcioná-los à decisão."},{"source_order":34,"status":"PREMISSA_EDITORIAL","text":"Deverá explorar como evidências provenientes da inteligência de mercado podem apoiar escolhas estratégicas, reduzir incertezas, comparar alternativas e identificar oportunidades e ameaças, reconhecendo também os limites dos dados e das análises.\n\nConclusão"},{"source_order":35,"status":"CONFIRMADO","text":"A conc